[
  {"id":"culvert","term":"culvert","pronunciation":"/ˈkʌlvərt/","category":"drainage","definition_en":"A pipe or small structure that carries water under a road, driveway, railway, or embankment.","explanation_ru":"Водопропускное сооружение под дорогой, подъездом или насыпью. Чаще всего это труба, по которой вода из канавы проходит на другую сторону.","translation_ru":["водопропускная труба","водопропускное сооружение"],"translation_vi":["cống thoát nước","cống ngang đường"],"example_en":"Install a 300 mm culvert under the driveway and restore the ditch line.","scenario":"Ditch water must pass beneath a driveway without flowing over the road surface.","visual":"Road cross-section with a pipe beneath it connecting ditches on both sides, arrows showing water flow.","related_terms":["ditch","headwall","storm sewer"],"common_mistakes":["A culvert usually conveys open-channel drainage under an obstruction; it is not automatically the same as a storm sewer main."],"difficulty":1},
  {"id":"ditch","term":"ditch","pronunciation":"/dɪtʃ/","category":"drainage","definition_en":"A shallow open channel used to collect and carry surface water.","explanation_ru":"Открытая канава для сбора и отвода поверхностной воды вдоль дороги, площадки или границы участка.","translation_ru":["канава","водоотводная канава"],"translation_vi":["mương thoát nước","rãnh thoát nước"],"example_en":"Regrade the roadside ditch to maintain positive drainage to the culvert.","scenario":"Rainwater is carried in an open channel beside the roadway.","visual":"Road shoulder beside a V-shaped open channel with water flowing toward a culvert.","related_terms":["culvert","swale","daylighting"],"common_mistakes":[],"difficulty":1},
  {"id":"catch-basin","term":"catch basin","pronunciation":"catch BAY-sin","category":"drainage","definition_en":"A drainage inlet that collects surface runoff and directs it into a storm sewer, often with a sump for sediment.","explanation_ru":"Дождеприёмный колодец, который принимает воду с поверхности и направляет её в ливневую систему. Часто имеет отстойную часть для песка и мусора.","translation_ru":["дождеприёмный колодец","ливнеприёмник"],"translation_vi":["hố ga thu nước","hố thu nước mưa"],"example_en":"Connect the new catch basin to the existing storm main with a 200 mm lead.","scenario":"Water from pavement enters a grated box and then flows into underground storm piping.","visual":"Pavement with grated inlet above a box connected by pipe to a storm main.","related_terms":["manhole","storm-sewer","invert"],"common_mistakes":["A catch basin collects surface water; a manhole is mainly for access and junctions."],"difficulty":1},
  {"id":"manhole","term":"manhole","pronunciation":"MAN-hole","category":"utilities","definition_en":"An access structure on an underground utility system used for inspection, maintenance, direction changes, or pipe junctions.","explanation_ru":"Колодец доступа к подземной сети для осмотра, обслуживания, изменения направления или соединения труб.","translation_ru":["смотровой колодец","канализационный колодец"],"translation_vi":["hố ga","hố thăm"],"example_en":"Set the sanitary manhole to the rim and invert elevations shown on the drawings.","scenario":"Workers need a vertical access point to inspect underground pipes at a junction.","visual":"Round access cover at grade over a vertical chamber with incoming and outgoing pipes.","related_terms":["catch-basin","invert","storm-sewer"],"common_mistakes":[],"difficulty":1},
  {"id":"invert","term":"invert","pronunciation":"IN-vert","category":"drawings","definition_en":"The inside bottom elevation of a pipe or channel, used to define drainage grades and flow direction.","explanation_ru":"Отметка внутреннего низа трубы или канала. По invert elevations проверяют уклон и направление самотечного потока.","translation_ru":["отметка лотка трубы","отметка внутреннего низа трубы"],"translation_vi":["cao độ đáy trong ống","cao độ đáy ống"],"example_en":"Verify the downstream invert before ordering the manhole base.","scenario":"You need the elevation of the lowest inside point of a gravity pipe.","visual":"Pipe cross-section with an arrow pointing to the lowest inside point and an elevation label.","related_terms":["grade","manhole","stationing"],"common_mistakes":["Do not confuse pipe invert with pipe crown or outside bottom elevation."],"difficulty":2},
  {"id":"storm-sewer","term":"storm sewer","pronunciation":"storm SOO-er","category":"drainage","definition_en":"An underground pipe system that carries rainwater and surface runoff to an outlet or drainage facility.","explanation_ru":"Подземная ливневая сеть из труб и колодцев для отвода дождевой и поверхностной воды.","translation_ru":["ливневая канализация","ливневая сеть"],"translation_vi":["hệ thống thoát nước mưa","cống thoát nước mưa"],"example_en":"Tie the new catch basin lead into the existing storm sewer.","scenario":"Several catch basins discharge into an underground gravity pipe network.","visual":"Several street catch basins connected to one larger underground storm pipe.","related_terms":["catch-basin","culvert","manhole"],"common_mistakes":[],"difficulty":1},
  {"id":"watermain","term":"watermain","pronunciation":"WAW-ter-main","category":"utilities","definition_en":"A main underground pressurized pipe that distributes potable or service water through a utility network.","explanation_ru":"Основная напорная водопроводная труба, по которой вода распределяется по сети.","translation_ru":["водопроводная магистраль","водопровод"],"translation_vi":["ống cấp nước chính","đường ống cấp nước chính"],"example_en":"Maintain the required separation between the proposed storm sewer and the existing watermain.","scenario":"A pressurized municipal pipe supplies water to multiple service connections.","visual":"Large underground blue pipe with smaller service branches leading toward buildings.","related_terms":["service-connection","tie-in","trench"],"common_mistakes":[],"difficulty":1},
  {"id":"duct-bank","term":"duct bank","pronunciation":"DUKT bank","category":"electrical","definition_en":"A grouped system of conduits, usually encased in concrete, installed underground for electrical or communication cables.","explanation_ru":"Группа подземных кабельных труб, часто уложенных блоком и залитых бетоном для защиты электрических или телекоммуникационных кабелей.","translation_ru":["кабельный блок","блок кабельных труб"],"translation_vi":["cụm ống cáp ngầm","khối ống luồn cáp"],"example_en":"Excavate, install conduits, and concrete-encase the duct bank to the transformer pad.","scenario":"Multiple electrical conduits are bundled underground and protected with concrete.","visual":"Trench cross-section showing several conduits in rows inside a rectangular concrete encasement.","related_terms":["conduit","excavation","backfill"],"common_mistakes":[],"difficulty":1},
  {"id":"conduit","term":"conduit","pronunciation":"KON-doo-it","category":"electrical","definition_en":"A protective tube or raceway used to carry electrical or communication cables.","explanation_ru":"Защитная труба или канал, внутри которого прокладывают электрические или телекоммуникационные кабели.","translation_ru":["кабельная труба","защитная труба"],"translation_vi":["ống luồn dây","ống bảo vệ cáp"],"example_en":"Provide two spare conduits through the road crossing.","scenario":"Cable needs a protective pipe before being pulled underground.","visual":"Cable being pulled through a round conduit in an underground trench.","related_terms":["duct-bank","pull-box","trench"],"common_mistakes":[],"difficulty":1},
  {"id":"trench","term":"trench","pronunciation":"/trentʃ/","category":"excavation","definition_en":"A narrow excavation, typically deeper than it is wide, made for pipes, utilities, foundations, or drainage work.","explanation_ru":"Узкая выемка грунта, обычно для прокладки труб, кабелей, инженерных сетей или устройства основания.","translation_ru":["траншея"],"translation_vi":["rãnh đào","mương đào"],"example_en":"Excavate the trench to the required depth and prepare the pipe bedding.","scenario":"A narrow excavation is opened along an alignment for underground pipe installation.","visual":"Long narrow excavation with spoil pile on one side and a pipe being installed at the bottom.","related_terms":["excavation","trench-box","backfill"],"common_mistakes":[],"difficulty":1},
  {"id":"trench-box","term":"trench box","pronunciation":"trench box","category":"safety","definition_en":"A protective shield placed in an excavation to protect workers from cave-ins; it does not necessarily support the trench walls.","explanation_ru":"Защитный металлический короб в траншее, который защищает работников при обрушении грунта. Сам по себе он не обязательно удерживает стенки траншеи.","translation_ru":["траншейный щит","защитный короб для траншеи"],"translation_vi":["hộp chống sập rãnh","khung bảo vệ hố đào"],"example_en":"Use a trench box for pipe installation where the excavation depth requires protective measures.","scenario":"Workers must enter a deep trench and need protection from cave-in hazards.","visual":"Worker standing inside a steel trench shield placed within a deep excavation.","related_terms":["shoring","trench","excavation"],"common_mistakes":["A trench box shields workers; shoring is intended to support or restrain excavation walls."],"difficulty":2},